{
  "$schema": "https://json-schema.org/draft/2020-12/schema",
  "$id": "https://state-system.local/schemas/instance-preflight-result.schema.json",
  "title": "InstancePreflightResult",
  "type": "object",
  "required": [
    "id",
    "scope_key",
    "preflight_ref",
    "instance_ref",
    "connector_ref",
    "source_ref",
    "status",
    "checked_at",
    "evidence_refs",
    "proves_live_access",
    "authorizes_execution",
    "protected_action_authorized_by"
  ],
  "properties": {
    "id": { "type": "string" },
    "scope_key": { "type": "string" },
    "preflight_ref": { "type": "string" },
    "instance_ref": {
      "type": "string",
      "pattern": "^state_instance\\.[a-z0-9_.-]+$"
    },
    "connector_ref": { "type": "string" },
    "source_ref": { "type": "string" },
    "connector_type": { "type": "string" },
    "tool_ref": { "type": "string" },
    "action_ref": { "type": "string" },
    "agent_ref": { "type": "string" },
    "runner_ref": { "type": "string" },
    "status": {
      "type": "string",
      "enum": ["passed", "failed", "unknown", "planned"]
    },
    "checked_at": { "type": "string" },
    "stale_after": { "type": "string" },
    "ttl_seconds": { "type": "integer" },
    "evidence_refs": {
      "type": "array",
      "items": { "type": "string" }
    },
    "error": {
      "type": "object",
      "properties": {
        "code": { "type": "string" },
        "message": { "type": "string" }
      }
    },
    "detail": { "type": "string" },
    "proves_live_access": { "type": "boolean" },
    "authorizes_execution": { "type": "boolean" },
    "protected_action_authorized_by": { "type": "string" }
  }
}
