{
  "id": "instance_preflight_result.state_instance.braydon_personal-connector.personal.folio-folio-tenant-personal-preflight.state_instance.braydon_personal.connector.personal.folio.2026-05-16T19-42-47Z",
  "scope_key": "state_instance.braydon_personal|connector.personal.folio|folio:tenant:personal|preflight.state_instance.braydon_personal.connector.personal.folio||||",
  "preflight_ref": "preflight.state_instance.braydon_personal.connector.personal.folio",
  "instance_ref": "state_instance.braydon_personal",
  "connector_ref": "connector.personal.folio",
  "source_ref": "folio:tenant:personal",
  "connector_type": "folio",
  "status": "passed",
  "checked_at": "2026-05-16T19:42:47Z",
  "stale_after": "2026-05-16T20:42:47Z",
  "evidence_refs": [
    "local-path:/Users/braydon/projects/experiments/folio"
  ],
  "detail": "folio_root exists: /Users/braydon/projects/experiments/folio",
  "proves_live_access": true,
  "authorizes_execution": false,
  "protected_action_authorized_by": "governance"
}
